[
  {
    "id": "banana-bread-classic",
    "dish_id": "banana-bread",
    "title": {
      "en": "Small-batch banana bread",
      "de": "Kleines Bananenbrot"
    },
    "description": {
      "en": "The familiar smell of good things in the oven.",
      "de": "Der vertraute Duft guter Dinge im Ofen."
    },
    "contains": [
      "added-sugar",
      "dairy",
      "egg",
      "gluten",
      "lactose"
    ],
    "attributes": [
      "bake",
      "halal",
      "kosher",
      "medium",
      "vegetarian",
      "≤60"
    ],
    "tags": [
      "baking",
      "breakfast",
      "seasonal",
      "sweet"
    ],
    "dimensions": {
      "diet": "vegetarian",
      "effort": "medium",
      "calorie-level": "balanced"
    },
    "time_minutes": 60,
    "servings": 2,
    "calories_per_serving": 502,
    "macros": {
      "protein": 10.7,
      "carbs": 83.5,
      "fat": 14.0
    },
    "ingredients": [
      {
        "id": "banana",
        "quantity": 2.0,
        "unit": "piece",
        "note": {
          "en": "",
          "de": ""
        }
      },
      {
        "id": "flour",
        "quantity": 120.0,
        "unit": "g",
        "note": {
          "en": "",
          "de": ""
        }
      },
      {
        "id": "egg",
        "quantity": 1.0,
        "unit": "piece",
        "note": {
          "en": "",
          "de": ""
        }
      },
      {
        "id": "butter",
        "quantity": 25.0,
        "unit": "g",
        "note": {
          "en": "",
          "de": ""
        }
      },
      {
        "id": "sugar",
        "quantity": 20.0,
        "unit": "g",
        "note": {
          "en": "",
          "de": ""
        }
      },
      {
        "id": "baking-powder",
        "quantity": 1.0,
        "unit": "tsp",
        "note": {
          "en": "",
          "de": ""
        }
      },
      {
        "id": "cinnamon",
        "quantity": 1.0,
        "unit": "tsp",
        "note": {
          "en": "",
          "de": ""
        }
      }
    ],
    "steps": [
      {
        "title": {
          "en": "Heat oven to 180°C; line a small loaf tin",
          "de": "Ofen auf 180 °C vorheizen, kleine Kastenform auslegen"
        },
        "text": {
          "en": "Heat oven to 180°C; line a small loaf tin. Mash bananas and beat with egg, melted butter and sugar.",
          "de": "Ofen auf 180 °C vorheizen, kleine Kastenform auslegen. Bananen mit Ei, geschmolzener Butter und Zucker mischen."
        },
        "timer_seconds": 0
      },
      {
        "title": {
          "en": "Fold in flour, baking powder and cinnamon briefly",
          "de": "Mehl, Backpulver und Zimt kurz unterheben"
        },
        "text": {
          "en": "Fold in flour, baking powder and cinnamon briefly. Pour into the tin and level.",
          "de": "Mehl, Backpulver und Zimt kurz unterheben. In die Form füllen und glätten."
        },
        "timer_seconds": 0
      },
      {
        "title": {
          "en": "Bake 40 minutes until a skewer is clean",
          "de": "40 Minuten backen, bis ein Stäbchen sauber bleibt"
        },
        "text": {
          "en": "Bake 40 minutes until a skewer is clean. Rest 10 minutes before slicing into two generous portions.",
          "de": "40 Minuten backen, bis ein Stäbchen sauber bleibt. 10 Minuten ruhen, dann in zwei großzügige Portionen schneiden."
        },
        "timer_seconds": 2400
      }
    ],
    "note": {
      "en": "Read the whole method before you begin. Salt and water are pantry basics; season to taste.",
      "de": "Lies die Zubereitung vor dem Start durch. Salz und Wasser sind Vorratsgrundlagen; nach Geschmack würzen."
    }
  },
  {
    "id": "banana-bread-oat",
    "dish_id": "banana-bread",
    "title": {
      "en": "Banana & oat breakfast loaf",
      "de": "Bananen-Hafer-Frühstücksbrot"
    },
    "description": {
      "en": "Banana sweetness, with patience from the oven.",
      "de": "Bananensüße, mit Geduld vom Ofen."
    },
    "contains": [],
    "attributes": [
      "bake",
      "gluten-free",
      "halal",
      "kosher",
      "medium",
      "vegan",
      "vegetarian",
      "≤60"
    ],
    "tags": [
      "baking",
      "breakfast",
      "seasonal",
      "sweet"
    ],
    "dimensions": {
      "diet": "vegan",
      "effort": "medium",
      "calorie-level": "balanced"
    },
    "time_minutes": 55,
    "servings": 2,
    "calories_per_serving": 494,
    "macros": {
      "protein": 11.6,
      "carbs": 76.8,
      "fat": 15.6
    },
    "ingredients": [
      {
        "id": "banana",
        "quantity": 2.0,
        "unit": "piece",
        "note": {
          "en": "",
          "de": ""
        }
      },
      {
        "id": "oats",
        "quantity": 130.0,
        "unit": "g",
        "note": {
          "en": "",
          "de": ""
        }
      },
      {
        "id": "oat-milk",
        "quantity": 100.0,
        "unit": "ml",
        "note": {
          "en": "",
          "de": ""
        }
      },
      {
        "id": "flaxseed",
        "quantity": 15.0,
        "unit": "g",
        "note": {
          "en": "",
          "de": ""
        }
      },
      {
        "id": "olive-oil",
        "quantity": 1.0,
        "unit": "tbsp",
        "note": {
          "en": "",
          "de": ""
        }
      },
      {
        "id": "baking-powder",
        "quantity": 1.0,
        "unit": "tsp",
        "note": {
          "en": "",
          "de": ""
        }
      },
      {
        "id": "cinnamon",
        "quantity": 1.0,
        "unit": "tsp",
        "note": {
          "en": "",
          "de": ""
        }
      }
    ],
    "steps": [
      {
        "title": {
          "en": "Heat oven to 180°C and line a small tin",
          "de": "Ofen auf 180 °C vorheizen, kleine Form auslegen"
        },
        "text": {
          "en": "Heat oven to 180°C and line a small tin. Grind oats; rest flaxseed with milk for 5 minutes.",
          "de": "Ofen auf 180 °C vorheizen, kleine Form auslegen. Hafer mahlen; Leinsamen mit Drink 5 Minuten quellen lassen."
        },
        "timer_seconds": 300
      },
      {
        "title": {
          "en": "Mash banana with oil and flax mixture",
          "de": "Banane mit Öl und Leinsamenmischung zerdrücken"
        },
        "text": {
          "en": "Mash banana with oil and flax mixture. Fold in oat flour, baking powder and cinnamon.",
          "de": "Banane mit Öl und Leinsamenmischung zerdrücken. Hafermehl, Backpulver und Zimt unterheben."
        },
        "timer_seconds": 0
      },
      {
        "title": {
          "en": "Bake 35 minutes until firm and a skewer is clean",
          "de": "35 Minuten backen, bis Brot fest und Stäbchen sauber ist"
        },
        "text": {
          "en": "Bake 35 minutes until firm and a skewer is clean. Cool for 10 minutes before slicing.",
          "de": "35 Minuten backen, bis Brot fest und Stäbchen sauber ist. Vor dem Schneiden 10 Minuten abkühlen."
        },
        "timer_seconds": 2100
      }
    ],
    "note": {
      "en": "Read the whole method before you begin. Salt and water are pantry basics; season to taste.",
      "de": "Lies die Zubereitung vor dem Start durch. Salz und Wasser sind Vorratsgrundlagen; nach Geschmack würzen."
    }
  },
  {
    "id": "banana-bread-almond",
    "dish_id": "banana-bread",
    "title": {
      "en": "Gluten-free banana & almond loaf",
      "de": "Glutenfreies Bananen-Mandel-Brot"
    },
    "description": {
      "en": "A tender crumb and a toasted almond edge.",
      "de": "Zarte Krume und geröstete Mandelränder."
    },
    "contains": [
      "almonds",
      "dairy",
      "egg",
      "lactose",
      "tree-nuts"
    ],
    "attributes": [
      "bake",
      "gluten-free",
      "halal",
      "kosher",
      "medium",
      "vegetarian",
      "≤60"
    ],
    "tags": [
      "baking",
      "breakfast",
      "seasonal",
      "sweet"
    ],
    "dimensions": {
      "diet": "gluten-free",
      "effort": "medium",
      "calorie-level": "balanced"
    },
    "time_minutes": 55,
    "servings": 2,
    "calories_per_serving": 559,
    "macros": {
      "protein": 13.2,
      "carbs": 74.2,
      "fat": 23.2
    },
    "ingredients": [
      {
        "id": "banana",
        "quantity": 2.0,
        "unit": "piece",
        "note": {
          "en": "",
          "de": ""
        }
      },
      {
        "id": "rice-flour",
        "quantity": 100.0,
        "unit": "g",
        "note": {
          "en": "",
          "de": ""
        }
      },
      {
        "id": "almonds",
        "quantity": 40.0,
        "unit": "g",
        "note": {
          "en": "",
          "de": ""
        }
      },
      {
        "id": "egg",
        "quantity": 1.0,
        "unit": "piece",
        "note": {
          "en": "",
          "de": ""
        }
      },
      {
        "id": "whole-milk",
        "quantity": 80.0,
        "unit": "ml",
        "note": {
          "en": "",
          "de": ""
        }
      },
      {
        "id": "butter",
        "quantity": 20.0,
        "unit": "g",
        "note": {
          "en": "",
          "de": ""
        }
      },
      {
        "id": "baking-powder",
        "quantity": 1.0,
        "unit": "tsp",
        "note": {
          "en": "",
          "de": ""
        }
      }
    ],
    "steps": [
      {
        "title": {
          "en": "Heat oven to 180°C, line a small tin and grind almonds",
          "de": "Ofen auf 180 °C vorheizen, kleine Form auslegen und Mandeln mahlen"
        },
        "text": {
          "en": "Heat oven to 180°C, line a small tin and grind almonds. Mash bananas.",
          "de": "Ofen auf 180 °C vorheizen, kleine Form auslegen und Mandeln mahlen. Bananen zerdrücken."
        },
        "timer_seconds": 0
      },
      {
        "title": {
          "en": "Beat egg, milk and melted butter into bananas",